<!ELEMENT stock(new-car*, used-car*)>
<!ELEMENT new-car(model, price, mileage?)>
<!ELEMENT used-car(model, price, mileage, condition?)>
<!ELEMENT model(#PCDATA)>
<!ELEMENT price(#PCDATA)>
<!ELEMENT mileage(#PCDATA)>
<!ELEMENT condition(#PCDATA)>